{
  "schema": "lintel.adapter_proposal.v0",
  "adapter_id": "choreo.v0",
  "graph_hash": "sha256:da10ec6e5ccfe27c7ee10f4fe4db4a5d41588fe4a0e4d8de08dc7ad0cadbf300",
  "hw_id": "nvidia.sm_80",
  "compiler_ver": "choreoir==0.1.10;cuda.cxx",
  "enum_id": "gemm_tile",
  "kernel": {
    "name": "gemm_tile",
    "target": "cuda",
    "params": [
      {
        "name": "Ag",
        "dtype": "f16",
        "shape": [
          2,
          2
        ]
      },
      {
        "name": "Bg",
        "dtype": "f16",
        "shape": [
          2,
          2
        ]
      },
      {
        "name": "Cg",
        "dtype": "f32",
        "shape": [
          2,
          2
        ]
      }
    ],
    "buffers": [
      {
        "name": "Ag",
        "space": "gmem",
        "dtype": "f16",
        "layout": {
          "shape": [
            2,
            2
          ],
          "stride": [
            2,
            1
          ]
        }
      },
      {
        "name": "Bg",
        "space": "gmem",
        "dtype": "f16",
        "layout": {
          "shape": [
            2,
            2
          ],
          "stride": [
            2,
            1
          ]
        }
      },
      {
        "name": "As",
        "space": "smem",
        "dtype": "f16",
        "layout": {
          "shape": [
            2,
            2
          ],
          "stride": [
            2,
            1
          ]
        }
      },
      {
        "name": "Bs",
        "space": "smem",
        "dtype": "f16",
        "layout": {
          "shape": [
            2,
            2
          ],
          "stride": [
            2,
            1
          ]
        }
      },
      {
        "name": "C",
        "space": "regs",
        "dtype": "f32",
        "layout": {
          "shape": [
            2,
            2
          ],
          "stride": [
            2,
            1
          ]
        }
      },
      {
        "name": "Cg",
        "space": "gmem",
        "dtype": "f32",
        "layout": {
          "shape": [
            2,
            2
          ],
          "stride": [
            2,
            1
          ]
        }
      }
    ],
    "partitions": [
      {
        "name": "load",
        "role": "load",
        "width": 4
      },
      {
        "name": "math",
        "role": "math",
        "width": 4
      },
      {
        "name": "store",
        "role": "store",
        "width": 4
      }
    ],
    "body": [
      {
        "op": "pipeline",
        "id": "p0",
        "depth": 3,
        "body": [
          {
            "op": "copy",
            "id": "cA",
            "src": "Ag",
            "dst": "As",
            "partition": "load"
          },
          {
            "op": "copy",
            "id": "cB",
            "src": "Bg",
            "dst": "Bs",
            "partition": "load"
          },
          {
            "op": "barrier",
            "id": "b0",
            "wait_for": [
              "load"
            ],
            "arrive": "math"
          },
          {
            "op": "mma",
            "id": "m0",
            "a": "As",
            "b": "Bs",
            "c": "C",
            "partition": "math"
          },
          {
            "op": "barrier",
            "id": "b1",
            "wait_for": [
              "math"
            ],
            "arrive": "store"
          },
          {
            "op": "copy",
            "id": "cC",
            "src": "C",
            "dst": "Cg",
            "partition": "store"
          }
        ]
      },
      {
        "op": "yield",
        "id": "y0",
        "values": [
          "Cg"
        ]
      }
    ],
    "attrs": {
      "tile": "2x2"
    },
    "compiler_ver": "0.1.10"
  },
  "gates": [
    "W",
    "L",
    "S",
    "V"
  ]
}
